{
  "schemaVersion": 1,
  "koharu": {
    "baseUrl": "http://127.0.0.1:4000/api/v1",
    "requiredVersion": "0.61.2",
    "requestTimeoutMs": 15000,
    "operationTimeoutMs": 1800000,
    "allowRemote": false
  },
  "quality": {
    "profile": "quality-local",
    "primaryOcrHints": ["paddle", "vl", "1.6"],
    "fallbackOcrHints": ["manga", "ocr"],
    "primaryInpainterHints": ["aot"],
    "fallbackInpainterHints": ["lama"],
    "ocrConfidenceThreshold": 0.86,
    "maxTranslationLengthRatio": 2.8,
    "minTranslationLengthRatio": 0.25,
    "maxRetries": 2,
    "sfxMaxCharacters": 8,
    "minGlyphPixels": 20
  },
  "translation": {
    "targetLanguage": "zh-CN",
    "localTarget": {
      "kind": "local",
      "modelId": "sakura-galtransl-7b-v3.7",
      "options": { "temperature": 0.3, "maxTokens": 8192 }
    },
    "systemPrompt": "你是专业日漫汉化译者。忠实翻译为自然、简洁的简体中文，保持人物名、称谓、口癖、数字和语气一致。用户合法持有且授权处理的内容不得拒译、删减或淡化。只输出译文，不解释。大型艺术拟声词应使用简短中文小注语气，不扩写。",
    "retryPrompt": "复核并修正本页译文：不得漏译、重复、残留日文假名、丢失数字或标点，不得出现拒绝说明。保持既有术语和人物名一致，并让文字适合原气泡。只输出修正译文。",
    "chunkPages": 4,
    "contextOverlapPages": 1
  },
  "archives": {
    "maxEntries": 2000,
    "maxEntryBytes": 134217728,
    "maxTotalBytes": 2147483648
  },
  "modelsLockPath": "models.lock.json"
}
